ID,workflow_name,what_it_does,industry,tools_used,result_or_stat,hook_angle,status,posted_date,post_id
1,Abandoned Cart Recovery Bot,"Sends personalized WhatsApp/SMS messages to customers who abandoned cart within 30 minutes, offering 10% discount code",E-commerce,"WhatsApp Business API, Shopify, n8n, OpenAI GPT-4","Recovers 15-25% of abandoned carts, adding $12K-20K monthly revenue for average store",result,pending,,
2,AI Product Description Generator,"Automatically writes SEO-optimized product descriptions for new inventory using AI, includes keywords and emotional triggers",E-commerce,"OpenAI GPT-4, Shopify, Airtable, n8n","Saves 20 hours/week of copywriting work, improves product page conversion by 18%",process,pending,,
3,Dynamic Pricing Engine,"Adjusts product prices in real-time based on competitor pricing, inventory levels, and demand signals",E-commerce,"Shopify, web scraper, n8n, Google Sheets",Increases profit margins by 8-12% without losing sales volume,result,pending,,
4,AI Customer Support Agent,"Handles 80% of customer inquiries automatically via chat, escalates complex issues to human agents with full context",E-commerce,"ChatGPT API, Zendesk, Slack, n8n","Reduces support response time from 4 hours to 45 seconds, saves $3K/month in staffing",result,pending,,
5,Review Request Automation,"Sends personalized review requests 7 days after delivery, follows up twice, offers loyalty points for photos",E-commerce,"Klaviyo, Shopify, n8n, LoyaltyLion","Increases review collection rate from 2% to 18%, boosting SEO and social proof",result,pending,,
6,Inventory Alert System,"Monitors stock levels across all SKUs, predicts restock needs using sales velocity, auto-orders from suppliers",E-commerce,"Shopify, Google Sheets, n8n, supplier APIs","Eliminates stockouts by 95%, reduces overstock by 30%",problem,pending,,
7,AI Image Alt-Text Generator,Automatically generates SEO-optimized alt text for all product images using AI vision,E-commerce,"OpenAI Vision API, Shopify, n8n","Improves image search traffic by 35%, saves 10 hours/week",process,pending,,
8,Order Confirmation Calling Agent,"AI voice agent calls customers immediately after purchase to confirm order, answer questions, upsell accessories",E-commerce,"Vapi, Shopify, n8n, ElevenLabs","Reduces cancellation rate by 22%, increases average order value by $15",result,pending,,
9,Competitor Price Monitor,"Tracks competitor prices daily, alerts when they undercut you, suggests optimal price points",E-commerce,"Web scraper, n8n, Google Sheets, Slack","Maintains price competitiveness without race to bottom, protects margins",problem,pending,,
10,AI Returns Handler,"Processes return requests via chat, offers exchange instead of refund, generates return labels automatically",E-commerce,"ChatGPT API, Shopify, ShipStation, n8n","Converts 40% of returns into exchanges, saves $2K/month in refund losses",result,pending,,
11,VIP Customer Recognition,"Identifies high-value customers automatically, applies VIP tags, sends exclusive offers, assigns dedicated support",E-commerce,"Shopify, Klaviyo, n8n, Slack",Increases customer lifetime value by 35% for top 10% of customers,result,pending,,
12,AI Size Recommendation Bot,"Asks customers 3 questions about fit preferences, recommends perfect size, reduces size-related returns",E-commerce (Fashion),"ChatGPT API, Shopify, n8n",Reduces return rate by 28% for fashion retailers,problem,pending,,
13,Flash Sale Countdown Bot,"Sends escalating urgency messages during flash sales: 2 hours left, 30 min left, 5 min left with personalized recommendations",E-commerce,"WhatsApp API, Shopify, n8n, Klaviyo",Increases flash sale revenue by 45% vs single announcement,result,pending,,
14,AI Product Bundler,"Analyzes purchase patterns, creates smart product bundles, auto-generates bundle pages with AI descriptions",E-commerce,"Shopify, Google Analytics, n8n, OpenAI GPT-4","Increases average order value by 25%, moves slow inventory",result,pending,,
15,Shipping Delay Proactive Notify,"Monitors shipping tracking, detects delays before customer notices, sends proactive apology with discount code",E-commerce,"AfterShip, Shopify, n8n, Klaviyo","Reduces ""where is my order"" tickets by 70%, turns bad experience into loyalty",problem,pending,,
16,AI Upsell at Checkout,"Analyzes cart contents, suggests relevant upsell with one-click add, handles objections via chat",E-commerce,"Shopify, ChatGPT API, n8n","Increases checkout conversion by 12%, adds $8K-15K monthly revenue",result,pending,,
17,Supplier Performance Tracker,"Tracks every supplier order, measures on-time delivery, quality score, auto-generates performance reports",E-commerce,"Google Sheets, n8n, supplier portals","Identifies underperforming suppliers, reduces defective inventory by 40%",process,pending,,
18,AI Gift Recommendation Engine,"Asks 3 questions about recipient, budget, occasion, recommends perfect products with gift wrapping option",E-commerce,"ChatGPT API, Shopify, n8n","Captures gift market segment, increases holiday revenue by 30%",result,pending,,
19,Win-Back Dormant Customers,"Identifies customers who have not purchased in 90 days, sends personalized ""we miss you"" offer with AI-generated reason to return",E-commerce,"Klaviyo, Shopify, n8n, OpenAI GPT-4","Reactivates 8-12% of dormant customers, costs 70% less than new customer acquisition",result,pending,,
20,AI Product FAQ Generator,"Analyzes customer support tickets, generates comprehensive FAQ page, auto-updates as new questions arise",E-commerce,"Zendesk, OpenAI GPT-4, n8n, Shopify","Reduces support tickets by 35%, improves SEO with long-tail keywords",process,pending,,
21,AI Onboarding Sequence,"Sends personalized onboarding emails based on user behavior, triggers in-app messages for stuck users, schedules demo calls for high-intent signups",SaaS,"Mixpanel, Intercom, n8n, Calendly, OpenAI GPT-4","Increases activation rate from 25% to 60%, reduces churn by 20%",result,pending,,
22,Churn Prediction & Prevention,"Analyzes user engagement patterns, predicts churn risk 14 days in advance, triggers retention campaigns for at-risk accounts",SaaS,"Mixpanel, HubSpot, n8n, OpenAI GPT-4","Reduces monthly churn by 35%, saves $50K+ in annual recurring revenue",result,pending,,
23,AI Sales Qualification Bot,"Qualifies inbound leads via chat, asks BANT questions, scores leads, books meetings for SQLs, nurtures MQLs with content",SaaS,"ChatGPT API, HubSpot, n8n, Calendly","Increases sales team efficiency by 40%, reduces unqualified demos by 60%",result,pending,,
24,Feature Adoption Nudges,"Tracks which features users have not tried, sends personalized tutorials based on their use case, celebrates milestones",SaaS,"Amplitude, Intercom, n8n, Loom","Increases feature adoption by 45%, drives expansion revenue",process,pending,,
25,AI Release Notes Writer,"Monitors GitHub commits, auto-generates user-friendly release notes, categorizes by feature/bug/fix, publishes to changelog",SaaS,"GitHub, OpenAI GPT-4, n8n, Webflow","Saves product team 5 hours/week, keeps customers informed and engaged",process,pending,,
26,Trial-to-Paid Conversion Engine,"Monitors trial user activity, identifies power users, sends targeted upgrade offers, handles objections via AI chat",SaaS,"Stripe, Mixpanel, ChatGPT API, n8n","Increases trial conversion from 8% to 18%, adds $30K MRR",result,pending,,
27,AI Support Ticket Triage,"Reads incoming support tickets, categorizes by urgency and topic, suggests solutions from knowledge base, assigns to right agent",SaaS,"Zendesk, OpenAI GPT-4, n8n, Notion","Reduces first response time by 70%, increases resolution rate by 25%",result,pending,,
28,Customer Health Score Automation,"Calculates health score from product usage, support tickets, NPS, contract value, alerts CSM when score drops",SaaS,"HubSpot, Mixpanel, n8n, Slack",Proactively saves 15% of at-risk accounts before they churn,result,pending,,
29,AI Demo Personalization,"Researches prospect before demo, generates personalized talking points, creates custom demo environment with their data",SaaS,"Apollo.io, OpenAI GPT-4, n8n, Salesforce","Increases demo close rate by 35%, reduces prep time by 80%",process,pending,,
30,Usage-Based Billing Automation,"Tracks API calls, seats, storage usage, generates accurate invoices, alerts customers approaching limits, suggests upgrades",SaaS,"Stripe, Mixpanel, n8n, Slack","Eliminates billing disputes by 90%, captures 12% more revenue from usage",result,pending,,
31,AI Competitor Mention Alert,"Monitors Reddit, Twitter, G2, Capterra for competitor mentions, analyzes sentiment, alerts sales team to competitive deals",SaaS,"Brand24, n8n, Slack, OpenAI GPT-4","Identifies 50+ competitive opportunities monthly, wins 20% more competitive deals",result,pending,,
32,Product-Led Growth Analytics,"Tracks viral coefficient, time-to-value, activation milestones, generates weekly PLG report for leadership",SaaS,"Amplitude, Google Sheets, n8n, Slack",Provides data-driven insights that 3x referral signups in 6 months,process,pending,,
33,AI Contract Renewal Assistant,"Identifies upcoming renewals 90 days out, generates renewal proposals, handles negotiation objections, escalates complex deals",SaaS,"HubSpot, DocuSign, ChatGPT API, n8n","Increases renewal rate by 18%, reduces discounting by 25%",result,pending,,
34,Bug Report Intelligence,"Collects bug reports from multiple channels, deduplicates, prioritizes by impact, generates reproduction steps, assigns to engineers",SaaS,"GitHub, Sentry, n8n, Linear, OpenAI GPT-4","Reduces time-to-fix by 40%, improves customer satisfaction scores",process,pending,,
35,AI Customer Success Playbooks,"Analyzes top-performing customer success patterns, auto-generates playbooks for different customer segments, tracks playbook effectiveness",SaaS,"HubSpot, Notion, n8n, OpenAI GPT-4","Standardizes best practices, reduces CSM onboarding time by 50%",process,pending,,
36,AI Appointment Reminder System,"Sends personalized appointment reminders via WhatsApp/SMS 24h and 2h before, handles rescheduling, fills cancellations from waitlist",Medical/Clinics,"Twilio, WhatsApp API, n8n, Calendly","Reduces no-shows by 45%, recovers $8K-15K monthly in lost appointments",result,pending,,
37,Patient Follow-Up Automation,"Sends post-visit care instructions, medication reminders, satisfaction surveys, flags negative responses for staff follow-up",Medical/Clinics,"Klaviyo, Typeform, n8n, OpenAI GPT-4","Improves patient satisfaction by 30%, increases Google reviews by 5x",result,pending,,
38,AI Insurance Verification Bot,"Verifies insurance eligibility before appointment, alerts staff to issues, estimates patient responsibility",Medical/Clinics,"ChatGPT API, insurance portals, n8n","Eliminates 90% of billing surprises, reduces front-desk workload by 15 hours/week",problem,pending,,
39,Lead Nurturing for Aesthetic Clinics,"Nurtures consultation inquiries with educational content, before/after photos, FAQ answers, books consultation when ready",Medical/Aesthetic,"Instagram DM, WhatsApp, n8n, ChatGPT API",Increases consultation booking rate from 15% to 40%,result,pending,,
40,AI Medical Scribe,"Listens to doctor-patient conversation, generates structured SOAP notes, fills EHR fields automatically",Medical/Clinics,"Whisper API, OpenAI GPT-4, n8n, EHR system","Saves doctors 2 hours/day on documentation, reduces burnout",result,pending,,
41,AI Cold Email Personalizer,"Researches prospect from LinkedIn, website, news, writes hyper-personalized cold email with specific pain point mention",Sales/B2B Agency,"Apollo.io, OpenAI GPT-4, n8n, Instantly","Increases cold email reply rate from 1% to 8%, books 3x more meetings",result,pending,,
42,Lead Scoring Automation,"Scores every lead based on behavior, firmographics, engagement, alerts sales team when lead hits SQL threshold",Sales/B2B Agency,"HubSpot, Clearbit, n8n, Slack","Sales team focuses on high-probability leads, increases close rate by 25%",result,pending,,
43,AI Proposal Generator,"Analyzes discovery call notes, generates customized proposal with pricing, scope, timeline, case studies, sends for e-signature",Sales/B2B Agency,"OpenAI GPT-4, PandaDoc, n8n, HubSpot",Reduces proposal creation time from 4 hours to 15 minutes,process,pending,,
44,CRM Data Enrichment,"Auto-fills missing contact data from LinkedIn, company websites, news sources, keeps records updated weekly",Sales/B2B Agency,"Apollo.io, Clearbit, n8n, HubSpot","Increases contact data completeness from 40% to 95%, improves outreach targeting",process,pending,,
45,AI Sales Call Analyzer,"Transcribes sales calls, identifies objections, tracks talk ratio, scores performance, suggests improvements",Sales/B2B Agency,"Fireflies.ai, OpenAI GPT-4, n8n, Google Sheets",Improves rep performance by 30% in 90 days through data-driven coaching,result,pending,,
46,AI Property Inquiry Responder,"Answers property inquiries 24/7 via chat, qualifies buyers by budget/timeline, schedules showings, follows up after visits",Real Estate,"ChatGPT API, WhatsApp, n8n, Calendly","Responds to 100% of inquiries in under 30 seconds, increases showings by 40%",result,pending,,
47,Automated Listing Distribution,"Publishes new listings to Zillow, Realtor.com, Facebook Marketplace, Craigslist simultaneously with optimized descriptions",Real Estate,"n8n, OpenAI GPT-4, various APIs","Saves 3 hours per listing, increases exposure by 5x",process,pending,,
48,AI Buyer Nurturing Sequence,"Sends personalized property recommendations based on search history, market updates, financing tips, books consultation when ready",Real Estate,"Klaviyo, MLS data, n8n, ChatGPT API",Converts 12% of website visitors to buyers vs 3% industry average,result,pending,,
49,Seller Follow-Up Automation,"Monitors market conditions, sends monthly home value reports, alerts when market favors selling, generates CMA on demand",Real Estate,"Zillow API, n8n, Mailchimp, OpenAI GPT-4",Generates 2-3 listing appointments monthly from past clients,result,pending,,
50,AI Lease Renewal Negotiator,"Analyzes market rent trends, generates renewal offers, handles tenant objections, schedules signing, flags move-out risks",Real Estate/Property Management,"ChatGPT API, DocuSign, n8n, Rentometer","Increases renewal rate by 20%, reduces vacancy to under 5%",result,pending,,
